subreddit,text_tokens
techsupport,Laptop without wi fi Compaq CQ So have an laptop Compaq CQ and not sure if it has wi fi or not bought it from colleague of mine and he said it had but from the start couldn get it to work know it was dumb not testing before buying but really needed it at the time It worked with an ethernet cable so was ok with it thought ok ll figure out the wi fi later but never got it to work The manufacter website says that by pressing Fn F3 it turns on and off but tried it and it doesn seem to work In fact it shows an option of extra monitor duplicating screen instead of wi fi options The drawing on the F4 shows what assume wireless symbol so tried pressing it too and there was no difference ve tried Uninstalling and installing drivers Checking for updates Installing different drivers Fn F3 F4 not sure what else to do since ve tried everything that comes to mind Also think the ethernet connection stopped working so the laptop is just pretty just sitting there waiting to be fixed Thanks in advance
techsupport,Toshiba satellite laptop black screen My laptop was fine until this morning When turned it on after the toshiba logo black screen appears there is light but its black if you understand white underscore blinked two times and the screen remains like that with nothing tried hard reset removing battery and ram keyboard stuff to access something does not respond except ctrl alr delete but that only shows underscore again and tge screen stays black dont know anything about the computers but am not in the mood to take it to the reapir shop
techsupport,Unable to connect to laptop am at my wit end with this bloody thing have Boss Katana mk2 and Gateway GWTN156 BK When attempt to connect the to my laptop with the USB printer cable get device descriptor request failed When connect the to my USB hub my laptop doesn register anything being plugged in have attempted to troubleshoot in every way ve found ve reset the to factory settings ve contacted the manufacturer and had them send me the driver to install manually ve tried multiple cables ve tried different computer ve uninstalled the broken USB device and rebooted the computer ve disabled fast startup and ve changed my USB selective suspend settings When the is in updater mode the lights on it flash and stop flashing when it is connected and they do stop flashing when it plugged in to either the laptop or hub so it should be connecting The only other instances ve found where people have been unable to solve this has resulted in either giving up or purchasing multiple cables until one magically works Any help with this would be greatly appreciated am fairly computer illiterate but was able to follow the steps on various articles to complete the stuff above so please keep it simple if you have any solutions thank you in advance
techsupport,An SSD problem So ive got this SSD given to me by friend to try to fix it the issue despite looking intact and everything when insterted into my laptop its like it doesnt exist won show up in BIOS cmd prompt devices or files Is it dead is there any chance of saving it
techsupport,So my Asus rog g713ie hx011 screen drivers are messed up As said my g713ie hx011 just bought isn working correctly The screen has extremely bad contrast and unatural colors and some other image quality issues but it so bad it has to be something related to software because there is no way this laptop looks worse than laptop have updated the graphics drivers from Nvidia GeForce experience If you need more details ask for them in the comments and thanks in advance
techsupport,Everything boots up on my PC but any USBs don work mouse keyboard My mouse and keyboard work in bios and the failed windows boot up but if make it to my password screen both my mouse and keyboard just die The lights go out and they won even let me in to type my password to try and update drivers even went and bought cheap wired mouse and keyboard to test if it was the drivers and it the same situation for them as well completely lost and am saving up for new rig all together but love to get this one accessible while save Thanks for any help
techsupport,Pc won turn on Specs Ryzen Asus prime a320m GTX ti gb ssd have been away for December so haven started my PC for about month until yesterday started it and tried to play the new GTA update but my PC kept restarting as soon as get in game On reliability checker it said that desktop window manager stopped working bunch of times tried to do all the solutions that found online such as running the scannow command on CMD which came back with nothing Disabling automatic restart which didn help And bunch of other solutions After while tried clean windows install had windows before This had the same issues So my guess is that it is hardware related Thoughout this time could switch on and unlock the PC just fine If did nothing then the PC would never turn off also noticed that settings would crash when changing the display options After while got fed up and decided to try switch to windows After using another PC to make media creation tool plugged it in and tried to install windows got to the point just after you finish installing windows just before you sign in to your account and select what features you want when my PC shut off and cannot get the screen to turn on When try to turn it on the fan lights turn on as well as the keyboard lights but the mouse lights don work and the screen doesn work also can turn the PC off with the power button after try to turn it on need solution to get my PC on and stop or resetting Or need to know what part need to replace Edit also tried to launch the PC without the GPU using the Vega graphics in the cpu but that didn work
techsupport,Auto repair loop on Windows can no longer even boot into Safe Mode Hi my mom Windows PC is stuck where it tries to auto repair and diagnose problem but it never works Safe mode causes CRITICAL_PROCESS_DIED message There are other troubleshoot options like resetting the PC but all of those require her Outlook password which works perfectly fine to login on other devices but is now not working on this PC With Safe Mode all Safe Mode options not working there no way to access anything other than the troubleshoot restart etc screen Does anyone have any tips on ways to get around that password issue Or to resolve the auto repair problem in general Kinda worried that this PC might just be straight up dead soon
techsupport,Windows failed to start upon initial boot up After leaving just my new SSD in inserted windows boot drive and the windows failed to start screen popped up can find way around it Does anyone know how can fix this and install windows
techsupport,Windows Explorer takes long time to open and is slow got new Gaming PC in December and it been great although in the last few weeks ve been having some Windows problems Namely with Windows Explorer when click to open it can be waiting about seconds for the folder to open then another seconds of the folder just being blank white then once click on something say another folder it another second wait whilst it loads Not sure what the problem is
techsupport,How to kluge iMessage from PC Does anyone know of way to set up kluge so that can use iMessage from my PC For exle maybe there am email address you can use to send an iMessage to someone but it has to come from an apple email address so you set up two gmail accounts set the reply to address on the first to your apple ID and the other to your actual email address Then you set up forwarding and set the reply to on the second address to be your apple ID Then you blah blah blah blah Etc Anybody have any ideas about how to do something like this want to be able to send to iMessage from my PC
techsupport,Ethernet cable So it wanted to use wired connection to my computer desktop there is port that says CAT have cable but do know where the port goes to or how to make that work with my router have no idea what am doing and am wondering if you could help me Thank you
techsupport,Port is open but friends can connect to my Minecraft server have my external IP address confirmed and multiple sources saying that my port is open When go and host server though nobody can join except me with my local IP
techsupport,To Build or Not to Build that is the question need some advice on what should do So my wife has been using my gaming laptop HP Omen to run her business She is wedding photographer and uses lot of Lightroom and photoshop The computer has been unbearably slow especially when making changes within Lightroom and exporting want to build her new PC but everything is extremely expensive and rather wait until HOPEFULLY the prices come down to more reasonable cost So im thinking of upgrading the laptop instead to save some money and make her happy Here are the specs of the HP Omen Intel i7 GHZ FCBGA1440 socket gb RAM gb internal SSD TB hard drive plus two external SSD for photo storage we will figure out better long term solution in the future Nvidia GPU The CPU typically runs at when doing normal tasks email Facebook etc but when she is in Lightroom or photoshop the CPU runs at and is boosted to around GHZ Everything else within task manager is super low except for RAM which runs at around on average So should build new PC or upgrade our current laptop If we upgrade do you think upgrading to an i9 would be the best move Thanks
techsupport,Google apps notifications appears few mins late bought the Samsung Galaxy A52 and have just started using it ve noticed that all my google calendar notifications are mins late have set the reminder for mins before If have an event or reminder scheduled for pm get the notification at instead of pm Gmail notifications also show up few mins late still use my old phone and have noticed that every Google app related notification shows up few minutes later on the Samsung Not sure if it happens with non google apps as haven paid close attention to that Is there any way that can fix this
techsupport,Audio stopped working Hello my audio has completely shut down the icon shows the volume as normal when clicked on but the troubleshooter says audio services not responding It was working this morning and when got back to my desk nothing updated windows along with all my drivers to no avails ve also already checked windows msc for the windows Audio which was turned off and unable to restart or start until changed the log on to local system any help would be greatly apreciated can provide screenshots if need be
techsupport,Intermittent Audio Graphics card output It seems like every time driver update is available through the GeForce Experience program my audio quits working HDMI to monitor then monitor out to speakers and sometimes it just doesn work at all randomly If it works it works it doesn like cut out If restart my computer few times sometimes it ll come back but sometimes it ll go week without coming back My monitor won show up at all as option as output device on windows guess my question is do you guys think this is software or driver issue or should look into cashing in the warranty on my card Build Intel I9 Z490 PRO PNY RTX XLR8 GB GB RAM Windows bit
techsupport,Does my monitor have built in computer Hi about year ago bought HP pavilion to use for my PS4 At the time was completely clueless about what was buying and only picked it because it looked flashy but after recently researching the monitor all of the reviews have been talking about how it has built in computer but mine shows no indication of this also don have box to refer to as the only one the store had in stock at the time was display model so don have any idea which model purchased Can you help
techsupport,my ideapad is dead and the charger has been acting strange when plug it in it won work usually just fiddle around to find the point where it charges thats not happening anymore can someone tell me what happened It just as the title says No matter what do it won work
techsupport,cannot do Windows reinstall but the USB stick works fine Hello my cousin laptop couldn boot windows He said he wants to keep his son photos Here what ve tried to do used llcd to wipe the drive and was able to back up his stuff on an hdd so have backed up his data x200B ve used an USB to flash the windows installation but ve been having issues with it Here are some photos of the errors x200B When try to boot the usb the pc stays in bootloop so it wont load the installation ve tried this before asking in the discord server ve wiped the usb drive and used the windows media installtion but didnt work plugged the USB stick in another laptop and can boot and do the install as normal so the USB works fine have entered the BIOS settings in the laptop and here what ve tried disabled the secure boot and tried to boot the usb but still in bootloop When had secure boot disabled changed it to CSM and then to UEFI but couldnt fix the bootloop The error had when booted windows is UNMOUNTABLE BOOT DEVICE x200B first thought the usb port was broken but tried pluggin the llcd USB and could boot it as normal believe the HDD is broken Something forgot to say before is that used gparted when had the llcd in order to wipe the drive Should just get another new drive x200B Finally will put the specs of the laptop CPU intel celeron N2820 GHz RAM MB BIOS version HDD SSD im not sure if it his and HDD or SSD but think it HDD TOSHIBA MQ01ABF050 The battery and charger work well no issues Laptop model TOSHIBA SATELLITE C50 If there some information that haven added here you may need to know ask me
techsupport,my computer wont let me open up zip files tried to download tiny task to automate things on game while was away or asleep and the download turned into what think is virus ve looked around the internet and nothing will work for uninstalling the software Whenever try to unzip file it opens up an ad to buy file unzipper and wont unzip the file ve tried installing new unzipping software and that doesn work either
techsupport,was downloading video from storage app called mega and when saved it it didn go into my photos not in the mega app not in my files Need help desperately It taking up lot of space and need it back desperately on mobile and think it classified as System Data on my storage app Im on iPhone
techsupport,TPM not working just went in the BIOS to enable AMD CPU fTPM and when go on the thing to check if can upgrade to windows it tells me that TPM is not detected
techsupport,Data lost or recoverable HP Omen think got it in so it kinda old Here my story Laptop tried updating one day and shut it down without knowing it was updating hate this auto update feature even when turn it off it still does it Anyways it worked fine after but would keep trying to update every so often and run into an error cause the update was corrupted now or something Fast forward to last week turn my laptop on and it black screen when get to the login screen restart and it tries to diagnose gives me an error and brings me to advanced options go to troubleshoot then advanced options and try uninstalling updates error try command prompt and checkdisk doesn work startup repair doesn work either go back to reset this PC and choose keep files and it gets to then gives error Now trying the hp recovery manager but when try to add file to back up it stalls for minute then exits to the previous screen Are my files just dead and have to do factory restore and delete everything Will it even work or am missing something The kicker is literally ordered an external SSD to back up my files last week and the day after my computer does this it hasn come yet so ve been testing backing up smaller files to USB maybe this is why recovery manager keeps backing out
techsupport,Can use the windows media creation tool to downgrade to windows Dont have USB can the media creation tool perform clean install Im fine with it clearing my disk and also one more question my pc shipped with windows then upgraded to then reinstalled Will still be able to use my product key or will have to buy another license
techsupport,Samsung Knox Guard Is there way to change the Samsung Knox Guard settings third party has remote access to my device and am not comfortable with this Thanks
techsupport,HWMonitor which GPU temperature is most important ve got GPU Memory and Hot Spot GPU max is at max usage Memory max is at max usage And Hot Spot max is at max usage Is that good bad or should turn down some settings
techsupport,Remove Windows file from nd drive Hey everyone built PC recently and decided to use my laptop NVMe drive as nd drive for the pc but dont want to remove everyfiles only windows files so get more free space without losing data that in there but ofc it gives me errors related to permissions does anyone have any idea that might help me already took own btw
techsupport,Strange internet issues Hello everyone For some reason my internet suddenly stopped working for all websites except for youtube instagram twitter and reddit there probably few more but strangely nothing else loads for me It either says that the site took too long to respond or that the connection timed out or that the connection was changed worried because have no idea what could do have no idea what caused this either x200B Hopefully someone can help it would be lifesaver
techsupport,Problem with clarity image on desktop Hello like in title all images put on my desktop are no clarity they are blurred or erased It any solution Sorry for my bad english
techsupport,Got this SSHD and is it good for RMA or is it false alarm So have ST2000DX002 SSHD from Seagate and got Uncorrectable Sector Count and Current Pending Sector Count at value of in CrystalDiskInfo don know how to read those value and that the main issue having here Saw some posts but not sure if it could be some specific behaviour of SSHD The thing is as soon as opened CrystalDiskInfo got Caution on that drive Here is link to screenshots Thank you for pointing me in right direction in advance
techsupport,Stranger sent me deleted Reddit photo posted year ago how did he get this The Reddit stranger will not tell me how he found the photo claiming that he hacked it The photo was from my camera roll and posted one year ago then deleted less than an hour later Did not go viral or anything He did not follow me at that time am aware that there is remove reddit and github application that pulls all comments post history but ve never seen one that pulls deleted photos as well The image he found is not posted anywhere else on the internet such as social media Thoughts
techsupport,Windows TB Not Loading Freezing Whenever boot up my computer and log in my taskbar is almost always frozen and doesnt work Everything else on the computer works fine but the taskbar keeps loading frozen while it operates fine Its annoying cause cant access certain aplications and have to restart every single time sometimes multiple just to get it to work Sometimes let it run for long time when im not in rush and it starts working Anybody know permanent fix really dont want to reset my pc Ive tried restarting windows explorer on task manager among other fixes None have worked
techsupport,Audio issues Hi everyone im having problem with the audio on my pc Had this same problem while back but it fixed it self by automatically installing an audio driver So basically the problem im having is there is simply no sound My headphones are working fine just checked them on my laptop It also says the driver is working just fine so im stuck herr troubleshooting for two hours want to add that last time before the issue appeared again had two playback devices and currently have only the realtek driver which also didn work the first time around would be very thankful if someone had an answer
techsupport,Windows Install Fails Error Code xC1900101 x20017 Hi trying to install Windows onto an older laptop Lenovo ThinkPad T500 am doing an in place upgrade from It has GB of RAM an SSD and Core Duo During the process Windows will BSOD and then tell me that the install failed due to Error Code xC1900101 x20017 It also says The installation failed in the SAFE OS phase with an error during BOOT operation It then reverts back to the old OS which is exactly what trying to get away from have had another ThinkPad T500 in the past and it was able to run Windows So unless this laptop has defect don think it is matter of its age being factor How can rectify this
techsupport,Two separate display drawing tablets show no signal when try to use them with my PC and completely lost on what to do Hi just fair warning am disaster when it comes to dealing with issues with my PC so any help at all would be appreciated received display drawing tablet Huion Kansas Pro as gift for Christmas recently had been using Wacom Intuos for over years at this point but the Kamvas is significantly different due to it being display tablet tried using it and the display just did not work tried everything it said on the official Huion site but it continued to show no signal and went to low power mode The tablet worked without the display could use the pen on both my PC monitors but the display on the tablet itself would not work The official site and Amazon support pretty much told me needed replacement lo and behold the replacement tablet ends up doing the exact same thing try everything tried with the first tablet again doesn work so end up getting frustrated and get refund on the replacement and return it decided to go with Wacom One this time since more familiar with Wacom and their hardware seems to generally be more reliable that Huion or XP Pen from what ve gathered Now in the same situation AGAIN The tablet mostly works but the display won work and always says no signal and goes to low power mode when try to turn it on feel like ve tried basically everything but there has to be something missing in regards to my PC itself again any help is appreciated as am getting exhausted trying to figure out what the issue is lol
techsupport,Help with hard to reach qr code There is QR code in hard to reach spot on my nest floodlight camera am trying to scan the QR code and re print it in high quality so don have to climb ladder to scan can manage to scan it with barcode scanner app but when try to take picture of it and re print it it is too blurry to scan again Any apps that will scan and allow me to print the qr code out in high quality
techsupport,Ementor Help Can anyone lead me in the direction of person that could work on project that am trying to figure out am in need of an app developer that could assist me with project
techsupport,Phone won connect to home wifi My phone won connect to my home WiFi All other devices in the house can connect to the WiFi but my phone can However my phone CAN connect to other WiFis It works at my friend house sometimes see my neighbours WiFi in my selections My WiFi address VM10 etc doesn show up but virgin media address does but that doesn work or at least don think it does have tried reseting my router reseting WiFi settings restarting my phone stuff like that Can any one help with this issue Idk if its my phone or the router
techsupport,Remote control error Hello guys don know if this goes here but have an universal remote that been trying to connect to Samsung smart tv and everything works fine but the back button does not work everything else does This issue has happened to me with two different remotes Could you guys give me hand or point me to the right group please Thanks in andvance
techsupport,Windows upgraded my laptop to windows few days ago and now everything takes forever to load or just doesn Does anyone know why this is happening
techsupport,Needs some Help Can any develop hack that will give driver perfect score on ementor
techsupport,Steam games crash to desktop regularly Event ID Application Hang Good evening x200B Pretty much every time play games the game runs great but crashes to desktop once or twice every hours It really annoying as generally play Fall Guys with team of friends and then leave them hanging It not just one game though Other games have the exact same symptoms x200B ve tried fresh install of Windows and tried installing the games on separate SSD This leads me to believe it hardware issue Or am missing really simple and obvious fix don really do anything with this particular PC besides play few Steam games and use discord at the same time It been doing this for years now x200B at wits end keep the PC and video card drivers up to date fresh install every time always in vain The problem persists Self built PC AMD Ryzen GB RAM NVIDIA RTX Two GB Samsung SSD Sles The program FallGuys client game exe version stopped interacting with Windows and was closed To see if more information about the problem is available check the problem history in the Security and Maintenance control panel Process ID f4 Start Time d804e569187832 Termination Time Application Path Program Files x86 Steam steamapps common Fall Guys FallGuys client game exe Report Id c85551cb af6a c08 bf73 fb3423ce2a Faulting package full name Faulting package relative application ID Hang type Unknown The program DaysToDie exe version stopped interacting with Windows and was closed To see if more information about the problem is available check the problem history in the Security and Maintenance control panel Process ID Start Time d7f904e3f14241 Termination Time Application Path SteamLibrary steamapps common Days To Die DaysToDie exe Report Id e26d064 c3f c33 d28ab121657d Faulting package full name Faulting package relative application ID Hang type Unknown x200B Thanks
