subreddit,text_tokens
techsupport,Win dwm exe is using way too much vram have been on Win since the beta in October when it released bit after uploaded to RTX dwm exe started using up to GB of vram which doesn even make sense the has GB of vram tried playing Doom Eternal while it was at GB and the game ran at like fps even with low textures tried finding fix and coudn so resorted to ending the dwm exe task so it would restart fixing it temporarily until it slowly started to rise again within few hours Today when started my PC went to go play Doom Eternal and had performce issues so went into task manager it was using GB so just restarted it like usual now the problem is it always at like GB of Vram usage even after restarting my PC multiple times and even after updating my Nvidia drivers to the newer ones that purposely was avoiding since it makes my TV unusable at hz by causing flickering even that didn fix it This is pretty big problem since at the can barely squeeze by with GB free as it is haven been able to find fix for this and it annoying me so much that honestly considering doing fresh Win install or ditching Windows entirely If anyone has fix for this would be incredibly thankful
techsupport,Toshiba Qosmio X70B10T graphics card not detected anywhere recently had this laptop formated and just realized that my normal graphics card which was AMD R9 M200X had been replaced by my processor graphics IntelR HD graphics can find my AMD drivers in device manager anymore my graphics card is mentioned nowhere in my bios and when tried to install new Radeon drivers the adrenaline software said have no AMD graphics card Is my card fried Can fix this somehow
techsupport,How to find original MD5 Hash Hello am trying to determine if file have downloaded has been tered with BEFORE downloading it My reasoning to solve this is to retrieve the original MD5 Hash however all have is the file that was sent from another party have used Windows and entered cmd and only got one MD5 hash value Is there another method to see block chain that consists of the source of the file and any changes that have been made after it was created Thank you
techsupport,Is it worth upgrading to Windows for mostly gaming and light productivity recently got the notif that can upgrade to Windows game on my Acer Nitro laptop and just wanna know if it is ready for gaming
techsupport,Deleted google tv remote can control tv was having trouble with my chromecast google tv remote so deleted it and tried to re pair it However it won let me repair it without controlling the tv so now am basically stuck until can find way to control the tv or factory reset it without controlling the tv couldn find way to fix my problem in the Google Home app The google tv app is only available on android devices which don have so downloaded bluestacks and opened the app but can seem to find the remote control button
techsupport,Windows Defender blocks svchost exe and RelPost exe something wrong know that scvhost exe and RelPost exe are found in Windows but the Relpost exe seems to be in Device Disk5 which is bit odd isn it And then scvhost exe is in userprofile Videoes Is this normal
techsupport,Need to find the power button LED pin layout on HP Z240 workstation So can get computer from work to take to home found one HP Z240 Tower workstation with Inter Xeon in it and was thinking of checking bit more of it by booting it up and eventually turn it into gaming rig of sorts Well it does not boot but noticed that the front powerbutton is not connected to the motherboard As in someone has severed the wires entirely was thinking that would just short the two power button pins with something and try to boot using that but can find anything regarding the pin layout on the internet So came here Any ideas feel like it is not good idea to start shorting random pins The product No is L8T12AV but that is pretty much all know of the system
techsupport,Asus laptop microphone picking up noise but not recording it Hi have an asus notebook laptop so Windows with an in built microphone described as Microphone Array Intel Smart Sound Technology for Digital Microphones Yesterday evening in Zoom meeting it just didn work at all and had to leave the meeting The microphone is still listed in the drivers so the laptop knows it there The weirder thing is that it is detecting the sound but it can seem to record the sound When go into sound settings the Test your microphone bar moves with the sounds make but every other app Zoom voice recorder WhatsApp etc cannot actually record the noises The little microphone icon in the bottom bar even appears when the apps are being used Here is list of everything ve tried that has not worked Restarting everything Uninstalling and reinstalling Zoom Checking for updated drivers Troubleshooting sound recording Uninstalling the Windows update installed the previous evening None of this has worked Any help or suggestions would be massively appreciated
techsupport,my friend got some viruses in his computer and need help Like said in the title know like nothing about viruses so need some help My friend opened setup and his pc just freeze when he restarted the computer his gpu usage just raised to He has virus called the in the blind that cant even find information in google It has trash can logo or something similar the other are named punisher and xmrig dont know if he has other viruses in his pc He is doing scan with spyhunter rn will edit later to post images of the scan and other things about this Let me know if the tag is wrong know nothing about this sorry
techsupport,Samsung Pay sucks recently changed my phone to the Galaxy M21 This phone does not support NFC but instead uses Samsung MST tech from Romania and none of the banks here support Samsung Pay and since my phone doesn have NFC can use Google Pay either Is there any work around to this would like to not rely on my cc or cash every time wish to make purchase at store since sometimes forget my wallet at home use Bank of Transylvania Banca Transilvaniei if that of any use also do have Revolut card but tbh ve never used it would find it pretty annoying to have to transfer money from my credit card to Revolut just to be able to use my phone for payments And to be fair not entirely sure can link Revolut to Samsung Pay either since never tried it
techsupport,FA login Hello have on the pc Windows and am using pin code and normal password to login however the kids seeing somehow the pincode or password On other device am using Manjaro and added FA to manjaro login which works fine did thinking it would be nice if would setup the Windows also with FA Is there method for free found some paid version but would avoid those don need Corporation level of security forgot to mention my microsoft account is used to Windows saw FA in microsoft account but it seems not valid to Windows login Thank you in advance the answers
techsupport,Photos from Onedrive appearing in my Samsung Galaxy gallery don want to see them there only want the to be on the Onedrive app How do do that also don want the syncing to stop uploaded the pictures to my Onedrive then tranfered them to my PC from the phone via cable open the gallery and see them all still in my phone connect the phone again see nothing in phone files on my pc then look at the path on the pictures in gallery and see onedrive It driving me crazy When move them from my phone want them gone How do remove this feature tries googleing or contacting microsoft support but they just send me to user forum where nobody responds Help please its driving me nuts If press unsync that not what want the pics are still there want them syncing but only appearing in Onedrive app not my gallery
techsupport,can login into Geforce Experience The login screen is just empty
techsupport,S20 FE Touchscreen issues when keyboard is open Hello guys have Problem with my Samsung galaxy S20 FE for few months now The Phone in general works great but when the keyboard is opened it kind of slows down touch recognition If swipe across the screen the Phone recognizes lot of singular taps instead of one long tap This problem leads to lot of issues For exle cant really make audio mesages on whatsapp which is not that bad of problem to be honest also made some accidental calls This problem seems to be software problem because if the keyboard isnt opened the touchscreen works great also looked up some forums with other user experiencing the same problem If you could help it would be really great
techsupport,Unusual Internet Problem So ve been having issues with my internet The modem and router say connected WITH internet my computer says connected with internet but have no internet ve had this happen on two machines both while watching hulu if that relevant was finished an episode no buffering issues then when went to move to the next it wouldn load and nothing else worked either Switched machines internet was working watched an episode internet wasn working anymore Did hulu screw up my machine just restarted my computer itself and got internet back but now wondering if load up hulu if it going to happen all over again Any help would be appreciated
techsupport,Graphic card not recognized Hello fellas bought yesterday an ASUS TUF GAMING with and everything was fine until updated it have used the windows updater and myasus app and now my graphics card is gone can even use geforce experience of update drivers as it says don have GPU In the devices manager and can find it HIDDEN under Intel UHD Graphics and if click on it it says it not connected to my PC code Also it appears in the BIOS menu Help please
techsupport,Windows randomly freezing Hello For year now ve been experiencing problem where Windows would randomly freeze can still move the mouse occasionally open folders but Task Manager is frozen when opened and it stays that way until force restart Another thing of note is that see the HDD LED light turn off when this happens ve noticed the frequency of it lessens when turn hardware acceleration off on my browser and Discord but Windows freezes almost on daily basis regardless The most frequent occurrence is when drawing Clip Studio Paint or working in Blender Some posts ve seen pointed that it might be faulty SSD but not sure anymore Anyone have anything similar happen
techsupport,Manga and content multiple monitor struggle want to be able to rotate my screen to swap from horizontal to vertical for manga reading to content consumption but when do with either windows settings or rotating application for hot keys it will move the alignment of the other monitors off every time do it and eventually makes it unusable Does anyone know how to fix monitor alignment for the different directions Almost like profile Or anything that could use to correct and prevent this
techsupport,How to view Ethernet and WiFi as separate networks with individual profiles in Network Sharing Center Hi there having exactly the same issue as the user in this thread here my Ethernet and WLAN connection is handled differently on my operating systems dual boot as shown in the screenshots below While on my all day multimedia system both connections are showing up as different networks and it therefore possible to give them specific names using the Registry both connections are merged in one network on my work study system As use this seperation to trigger specific task like to split them up on my work study system as well How can accomplish this ve already searched for two days on the internet but haven found any solution yet Would be really glad if somebody could help me out on this Thanks and greetings
techsupport,Desktop Black Screen And Unsure How To Fix It So to preface had restarted my computer for windows update The update was finishing up and got stuck on the mark for ten to twelve minutes so thought that progress had frozen shut the computer down but after restarting it the desktop remains blank If try to restart windows explorer it just disappears until go to task manager and run random folder However the desktop still doesn show up ran the SFC command but it showed no integrity issues Windows settings and everything else in it seemingly doesn exist The internet still works and the sound still works just can get to anything in the settings app on windows can access things like control panel and anything that uses file explorer can still run programs as long as running them through the task manager Windows hotkey combinations don work either obviously since there no start bar So just confused on how to approach this and what to do to fix it
techsupport,Why is all of the audio on my phone PC panned little to the left or the right depending the earphones use Both sides are working Also one of the earphones already used before didn have this issue until yesterday
techsupport,Lost access to gmail account from when was younger removed
techsupport,Firefox and only Firefox will stop being able to go to any web address after some time of use Fixed by ending the Firefox task in Task Manager Any idea what causes this ve already done full reinstall of Firefox When Firefox stops working some websites like Twitter still kinda work With Twitter it will show the sidebars but no content guessing its because of caching but idk This problem has only started tonight It started before the new Windows update was installed and is still happening after installed it Chrome and Edge are both not affected
techsupport,Discord audio while ago downloaded voicemeeter banana and it messed up my mic or so thought so uninstalled it returned my mic and bought another one turns out out my mic is not the issue audio banana ruined my discord audio my mic works perfect on everything else Please help ve been trying to fix this for months no videos have solutions for this
techsupport,Gigabyte B560M Aorus Pro Rev dual bios have new pc and Id like to know if my motherboard supports dual bios as couldnt find any info on google
techsupport,Clicked on suspicious link My friend got hacked on Twitter and someone sent link to all of his friends including me The link was fake link to Instagram but then it redirected me to see who spy on your account on Twitter website soon closed it Should be worried
techsupport,Ansel Session cannot be supported Trying to play battlefront clicking alt to dodge but each time do it takes some photo or whatever and my game is interrupted by an irritating as fuck pause it like quarter of second but it makes the game unbearable due to the fact you have to dodge How do get rid of that shitty thing and the app or whatever that makes it happen fed up and don want the Ansel session or whatever the fuck nor do want the thing that made me deal with that
techsupport,General question about not signed files Hi just found out that have files that are not signed by microsoft in my windows system32 folder whom are called Microsoft Bluetooth Drivrutin för handsfree profil Microsoft Bluetooth A2dp driver Is this normal thing wondering this especially as don have bluetooth on my PC My common sense is telling me this might be sign of currupted file that should remove Kind regards Michael Speiner
techsupport,VGA not working on Gigabyte H470M DS3H CPU Intel i7 Ram x16gb DDR4 MHz SSD Samsung SSD QVO TB iGPU Intel UHG Graphics GPU NVIDIA GeForce Super ve tried lot of things and from what can tell it isn the port the computer which is brand new seems to refuse any type of VGA input as even when use VGA to DVI adapter and plug it into the DVI port it doesn work have three monitors Middle one is plugged into my GPU and is working fine Right side is my DVI monitor which is plugged into my Integrated GPU and is also working fine Left side is my VGA which works when plug it into for exle laptop but not with my new computer Yes the option in my BIOS to allow the iGPU is on and yes ve updated the drivers From what and my IT guy can tell there seems to be some sort of option that is disallowing any type of VGA output
techsupport,Chrome making pc restart Hi all of sudden everytime open chrome for few sec it makes my pc restart While this is happening my cpu goes up to degres for no reason This is not heat problem this only happens when open chrome my pc just restarts and the fans still spins and led are on Really don know what it could be Thanks lt
techsupport,CPU overclock Problem attempted to overclock my CPU and now my PC doesn show display My USBs work and the PC turns on the but there is no display It also turns off on its own about every seconds already tried taking out the CMOS battery and doing the CMOS jumpers pins Please someone help
techsupport,Laptop Screen as Secondary Monitor Controller Needed Hello everyone Recently my gaming laptop an Acer Predator died motherboard issues While do not intend on dropping at least on new mb what do want to do is salvage the screen and use it as monitor perhaps portable have already disassembled the part but am unsure what controller and adapter cable need to realise this Thank you all in advance
techsupport,Firefox doesn open websites while other browsers can Firefox cannot load any website on my computer when Chrome for exle is working fine Refreshing Firefox or reinstalling it makes it work temporarily until it stops loading anything Right now it crashes anytime quit and wants to send crash report This happened out of nowhere and have no idea what changed tried updating Windows and that didn work Please help am on Windows latest update
techsupport,Need some guidance Hi guys have started new role with an organisation and my manager has asked me about the following We have location services requirement where we want to st the users IP address and check if users is in India while taking loan compliance risk task Can you suggest recommend some good partners in the industry for this What exactly should be looking for Like what kind of vendor would provide such service
techsupport,PS4 controller via bluetooth disconnects randomly after while As the title says couldnt find solution anywhere The lights on it go out Is it because its putting itself to sleep downloaded ds4windows tried reinstalling drivers for my bluetooth adapter and the controller restarted pc and reset the controller multiple times nothing works Another issue is when disconnect bluetooth and restart it bluetooth settings on windows says paired but its not connected theres no connect button so im having to remove the controller and reconnect just to have it disconnect again minutes later Thanks in advance
techsupport,Unable to access BIOS on Gigabyte M27Q Monitor Hi all This has been an issue with my previous build but recently upgraded using the Gigabyte M27Q monitor and for some reason whenever boot my PC it black screen until it loads Windows Attempting to access the BIOS will just result in permanent black screen until you reboot it just doesn output display when on the BIOS Plugging my PC to my TV via HDMI solves the issue displays the ASUS logo as it should and gives me the option to play around in my BIOS It not that big of deal PC works fine monitor works great just can access my BIOS
techsupport,Mobile hotspot when connected to laptop uses tremendous amounts of data in very short period of time Yesterday over gb data used in matter of minutes although the only thing was doing was playing music on youtube Then changing hotspot password and restarting pc made the data usage go back to normal so idk which one of the above two did the job Now today again the same issue started over mb of data used in matter of seconds even though ve nothing running in my pc What happening What should do
techsupport,GB RAM usage with almost no apps open My Dell G5 Laptop has gb RAM but most of the time with almost no window open have about GB RAM usage Here is youtube video showing my task manager Does anyone know why this happens or how to fix it
techsupport,Windows inaccessible boot device updated to new motherboard processor and got some new ram and everything went off without hitch then the next day crash when playing deep rock galactic no issues on day of new pc and now it saying it cant find boot drive happy to provide more info if needed but may need some help getting said info as not illiterate but not entirely competent with anything past basic understanding The only help could find on Microsoft website is windows fix and the web help chat proved to be worthless on mobile locked on mobile until fix this
techsupport,How do hide my wifi network from others try to get feasible way to keep the wifi for personal use only
techsupport,High ping and random extremely low upload speeds What should do ran normal scan with malwarebytes but that didnt pick up anything at first thought it was just one off thing but it has been happening multiple times and am pretty sure this has to be virus right Mbps Down Mbps Up It should be on both Also there is this issue of high ping only when connecting to EU servers so this could be related to it as well think am not sure how should go about fixing it If possible could someone guide me through this Thanks
techsupport,Vivo Y30 not recognising passcode any more from what can tell it also won let me factory reset without my pass code even from the boot menu Is there any way can force factory reset that anyone aware of or preferably just bypass the code to get into my phone know this option from safe source is probably much less likely Maybe missing something but it seems like bit of an oversight for them to not give me the option to reset my passcode or factory reset my phone
techsupport,Are MicroSD cards magnetic NOT data loss but able to be picked up by magnet Sorry all can find on Google Bing and DDG is the fact that it not subject to magnetic interference don care about the data nothing else interesting happened However moments after this happened and gave the police the footage my SD card made nosedive straight into the abyss of the seat rail of my car as was trying to put it back into my dashcam Should continue to poke around the area with magnetic pickup wand and it will actually pick up SanDisk Max Endurance GB if that makes difference or would have better luck either pulling out the carpet and seat to get to it or even just ordering new one Thank you
techsupport,How to properly prevent Evil twin router attacks any info on this that is actually in depth please let me know am interested in learning about this and how to to prevent it since hearing about it Now unsure if using wifi is even secure if another signal can just hijack the input password and router and or devices mac address Curious about info including public wifi and also home wifi not sure if this is the right area for this or homenetworking section
techsupport,NVIDIA Surround PhysX monitors hz Hello x200B Firstly hope am in the correct section and thanks in advance for your help x200B recently picked up new rd monitor in the sales and am having major issues getting my monitors to run at Hz using NVIDIA Surround to combine the into have inch gaming monitors with Sync compatibility are LG GL850 and is DELL DGF brand new all are connected to RTX via each DP All three monitors run x1440 at Hz individually when NVIDIA Surround is not used However x1440 Hz is the only available option to select in NVIDIA Surround hz works for the OS and games however Hz is why bought the monitors to begin with so would really like to get that working x200B These monitors all have the same panel LG made panel so was expecting the setup of NVIDIA Surround for Hz gaming to be relatively straightforward how wrong was Quite simply the LG DELL combination in NVIDIA Surround does not have selectable option for Hz x200B have the latest NVIDIA drivers installed OS is WIn10 with latest updates All monitors have the latest available stable firmware x200B have read the guide and tried using cru version to edit the settings however so far have been completely unable to get x1440 Hz working Any changes made in cru only seem to lower the combined resolution displayed and or mess up the spanned display across the monitors x200B My feeling on this is that the timing of the DELL which appears to be an exact refresh rate of Hz rather than Hz which is conflicting with LG Hz somehow although this is the first time ve had monitors and subsequently used cru x200B Note All three monitors are able to run at Hz with the option selectable on the DELL monitor settings via the buttons and via overclock on the LG so Hz shouldn be an issue have not OC the monitors though If anyone is able to help out with known working recommended settings for the mentioned inch Hz monitors using NVIDIA Surround with or without cru please let me know Also if this is not the best place to ask please point me in the right direction x200B Thank you
techsupport,Unable to Google search through the address bar Not sure if this is the right place to post Sorry if it not As the title suggests for some reason can Google search through the address bar If try just get an error saying it couldn connect to google use Firefox but have tested Chrome and Edge as well and the same thing happens there The problem seem to coincide with me getting new WiFi adapter but don see why that would cause the problem
techsupport,Windows audio problem After upgrading to windows ve been facing this issue can get output audio when using handsfree It only shows up on input devices have looked for driver updates and it the latest version still the problem remains Any solutions
techsupport,FAT vs FAT32 for BIOS update Hi guys have purchased ASUS ROG B550 Gaming motherboard have to update the bios so it works with my have read that you need USB formatted to FAT32 however have USB but it only gb one formatted to FAT rather than FAT32 will this still work to update the bios Thanks in advance
