subreddit,text_tokens
techsupport,Transfer Windows Pro Upgrade license to another computer ve spent couple hours searching for relevant info on this and what found either didn match my situation or was outdated so forgive me if it repeat question We had an OEM Dell Windows Home laptop that we bought last year We upgraded it to Windows Pro using the Microsoft Store That computer then quickly died We bought new OEM Dell Windows Home laptop The question is this can we transfer that Windows Pro upgrade license to the new laptop ve seen conflicting information some people say the upgrade license still counts as OEM since it was upgrading an OEM license and is thus nontransferable others say that it counts as separate Retail license To further confuse things when log into our Microsoft account and click on the product Windows Pro get this page pretty sure that since it was bought in the Microsoft Store the license doesn have product key Any ideas
techsupport,Turn power off and back on to USB port ve got flaky USB appliance that needs to be rebooted periodically SDI video to USB converter The PC is physically locked in console so love to not recycle the power by opening the locked console and unplug replug the device Rebooting the PC isn enough the USB port is still powered enough during reboot to not re cycle the device have to power the PC off and power it back on to reboot the USB device Is there way in the OS to kill power to USB port or bus of USB ports if have to Thanks in advance
techsupport,Help Needed Company Dropbox eating Computer Storage Long story short my company uses dropbox and we have ton of data tb believe However our Dropbox has been eating into my computer storage over time and no longer have memory on my computer which causes issues files not syncing etc am aware of selective sync and unfortunately cannot go this route to free up storage Laptop use for reference Newest Lenovo IdeaPad Laptop AMD Ryzen Quad Core Processor GB Memory GB Solid State Drive Windows Abyss Blue W1009DU also use all of the usb ports in my laptop for external monitors an external hard drive is out of the cards Has anyone had this issue before And how did you resolve Any help is appreciated Thanks
techsupport,My Word document size Pages increased by almost double so copied the contents of my word document to another document and the page numbers increased by almost double please help
techsupport,GPU stopped outputting signal when HDMI connected although DVI working fine So while ago when using HDMI on my GPU it suddenly stopped working and would just show no signal on my monitor although the system seemed to be running fine tried all the different HDMI cables had but had the same issue even tried using display port but got the same problem But somehow the DVI port works just fine even use dvi to HDMI adapter which is not ideal because of low refresh rate If anyone has any ideas why my HDMI port stopped working or has solution to fix it that would be great
techsupport,For some applications enabling hardware acceleration will result in very low FPS experience and everything is in slow motion why is that and how can it be fixed BTW tried DDU and installed fresh driver but it didn fix it Laptop CPU HQ GPU GTX Gb version Ram Gb
techsupport,The system cannot find the file specified Boot Issue Windows Hi had new Microsoft Edge update clicked on the at the top right and the update said Recommended Update and had an amber warning x200B clicked on it restarted my PC and now get The system cannot find the file specified on my screen and it keeps looping on the same error if press ok don get any Windows or Motherboard Manufacturer Splash screen ve tried multiple times booting into my bios failing every time x200B also tried booting with windows media key no luck their either x200B don know what to do any help would be very appreciated x200B If it would help these are my specs CPU i5 GPU Asus gb RAM gb Motherboard B460M ITX ac
techsupport,Windows Mail App images attachments slow to load Hello just wondering if there is fix for this or if windows mail app is known for being slow Using Windows btw Any tips much appreciated Thanks
techsupport,PC refuses to Sleep or Shut down Hello Yesterday this issue started with my computer It refuses to shut down or to sleep When press the sleep button the monitors turn off but the computer continues to run with all the lights and fans on When press shutdown the computer turns off and immediately turns back on When press restart it restarts normally only got this error PCI Express Active State Power Management ASPM has been disabled due to known incompatibility with the hardware in this computer but already tried disconnecting everything from the USB ports and cables without success The computer turns off with shutdown but it makes weird clicking sound when it goes off different than it did when it turned off normally Any ideas of what can do to fix this Thank you so much
techsupport,Basic question changing caller ID name have basic probably stupid question So my cell phone is currently on my dads plan which has maybe or phones on it belonging to different people Of course when any of us call someone his name appears on the outgoing caller ID know this is because he is the account holder but is there any way to change this so that we all can have our name from our own phones when calling people Im not sure this is even possible but figured id ask We all have samsung phones with Verizon Thanks
techsupport,would like some help please So my mom got me this old pc from our school so can draw with like drawing tablet on it and would like to add some better hardware because in its current state it cant run anything Mom is willing to spend something like USD something on it not including peripherals but she thinks that new laptop will be better What should get to make the PC better Here is the system summary of the old school PC feel free to ask any more information about the computer OS Name Microsoft Windows Pro Version Build Other OS Description Not Available OS Manufacturer Microsoft Corporation System Name DESKTOP PMT5VSO System Manufacturer HCL Infosystems Limited System Model HCL Desktop System Type x64 based PC System SKU To be filled by Processor Intel Core TM i3 CPU GHz Mhz Core Logical Processor BIOS Version Date American Megatrends Inc SMBIOS Version Embedded Controller Version BIOS Mode Legacy BaseBoard Manufacturer ECS BaseBoard Product H61H2 M6 BaseBoard Version Platform Role Desktop Secure Boot State Unsupported PCR7 Configuration Binding Not Possible Windows Directory Windows System Directory Windows system32 Boot Device Device HarddiskVolume1 Locale United States Hardware Abstraction Layer Version User Name DESKTOP PMT5VSO Manthan Time Zone India Standard Time Installed Physical Memory RAM GB Total Physical Memory GB Available Physical Memory MB Total Virtual Memory GB Available Virtual Memory GB Page File Space GB Page File pagefile sys Kernel DMA Protection Off Virtualization based security Not enabled Device Encryption Support Reasons for failed automatic device encryption TPM is not usable PCR7 binding is not supported Hardware Security Test Interface failed and device is not InstantGo Un allowed DMA capable bus device detected TPM is not usable Hyper VM Monitor Mode Extensions Yes Hyper Second Level Address Translation Extensions Yes Hyper Virtualization Enabled in Firmware Yes Hyper Data Execution Protection Yes btw only have the most basic computer knowledge so please dont go fully technical on me lol
techsupport,Windows display driver freeze since LG OLEDC1 FW dwm exe appcrash KERNELBASE dll Hi since my month old C1 did the fw update to have massive problems with my multi monitor setup have displays on my rtx latest driver installed connected main desktop display gt displayport c1 gt hdmi another monitor gt displayport For desktop work only the is on the c1 and the are on my sim rig the c1 is always in standby mode the other display and the whole sim rig only get power when in use controlled by powerstrip So when want to switch to the sim rig config just turn the tv and the power strip on windows then change the main display to the c1 and the as extended display this is still working but as soon as turn off the c1 windows freezes now the the display turns black for minute or longer sometimes the picture comes back but screen configuration isn anymore available dwm exe appcrash KERNELBASE dll what ve tried different display driver versions disabled windows fast startup turn on off sync turn on off hdr tried different refresh rates hz unistalll reinstall with ddu in safe mode windows repair installation different hdmi cables tv factory reset can reproduce the error everytime if the tv is not connected switching turning the other two sceens is no problem also can play games for hours without any crashes it just happens when turning off the c1 the last thing can think of is firmware downgrade but not sure how to do anyone can help thanks
techsupport,Windows automated update killed the boot This morning when booted windows It finished some updated it started on its own then it went on to reboot and it never rebooted on windows still have my UEFI menu working and my linux boot fine but when try to boot windows get black screen for half second and then back in the UEFI menu x200B Any insight into what the update might have contained that created this problem
techsupport,How do setup diferent language input method on physical keyboard have keyboards and wanted to setup diferent language input method on those have tired of having to switch Win space Alt shift while working with foreign language Tiếng Việt on some graphic design program Pts Ai These program doesnt work with Telex input So wanted to use my second keyboard only for Tiếng Việt Built in key board for shortcut key Does anyone know how to set this up An AutoHotKey script would be nice
techsupport,Bluetooth is freaking out not connecting Hey guys just bought myself new premade computer and basically setting it up for this week Everything runs like butter however the bluetooth seems to crap itself For some reason any bluetooth headphone or speaker takes suuuuppperr long to connect and when it does stutters or sound at all At first was thinking maybe the built in bluetooth was just really cheap or something so plugged in my bluetooth usb adaptor but the device has an error code and dosent work as well Ive tried clean reinstalling windows updating windows reinstalling drivers basically everything but no dice Any help would be awesome as computer with no sound is just depressing
techsupport,Can constantly going into Sleep Mode and waking it up fry your HDMI port So my computer kept waking up the second it went into sleep mode This is the first time it done this so wasn sure what was the issue tried changing some settings so my mouse keyboard headset etc wouldn wake it up but it kept doing it After around the th or th time putting my PC to sleep one of my monitors just stopped working plugged the other monitor into the HDMI port with the monitor that not working and it also didn work However the other HDMI port works fine even though both ports are part of the same HDMI hardware Sorry don know much about hardware terms lol went to device manager to see if my HDMI just stopped completely and really can tell It shows my graphics card and Intel UHD Graphics which assuming neither has anything to do with HDMI At this point just really frustrated and confused Why does my PC keep waking up from sleep even though my wake timers are disabled Why does only one of my HDMI output not work but the other one works fine
techsupport,Monitors crash when gaming pc has to reboot Hi there ve spent weeks now looking into lots of posts online and on here about this issue and everyone seems to have their own different fixes that haven worked for me so hoping can find some help As the title says lately whenever ve been gaming both of my monitors turn off as if they lose power and just say there no signal Sometimes this is an hour into gaming mins or mins Sometimes can go week without it happening but the last days it every time boot up game games like FFXIV Genshin Impact Dead by Daylight for instance not tech literate but here some info if you need more let me know and apologies if you need to spell things out for me like simpleton Processor AMD Ryzen Eight Core Processor GHz Graphics Card Radeon RX Series using two of the following monitors Samsung C27F390 Inch Curved LED Monitor HDMI VGA Black Gloss Both are plugged into the GPU one via HDMI and one not forgot the term scart unfortunately don have HDMI ports on my GPU ve tried completely uninstalling and reinstalling my graphics card drivers ve even tried rolling back to previous update ve tried uninstalling recent Windows updates just in case it was that ve got all games set to the minimum graphics settings ve tried reinstalling the games Nothing seems to fix it and it getting worse think may need to upgrade my GPU as bought this years ago when built the PC myself But as GPUs are ridiculously expensive right now reluctant to do that if it not going to be the fix It also does the same thing when run stress test starting to get really stressed out about this now and honestly have no idea what to do any more
techsupport,Cant reinstall windows on ideapad while ago upgraded my girlfriends ssd on her ideapad ICH It was originally an optane drive paired with her hdd We recently built her pc and used the ssd we placed in the laptop for that have now tried reinstalling the original optane drive and doing fresh windows install but am stuck in boot loop which takes me into windows recovery and the laptop will not recognise the brand new usb flash drive which am trying to boot from Any ideas on what happening
techsupport,Brand new laptop with windows shows logs in Event Viewer from last year Is it possible that the laptop is refurbished instead of new on day and it crashed and rebooted twice already Please help
techsupport,Mic sounds wierd using the kraken headset right now on my pc but it sounds like talking from across the room tried to use different mic but it had the same problem so went to Google and found to make it but nothing seemed to work any suggestions and could it be case problem
techsupport,What is this cable One end is micro usb and the other is just the yellow and white rca connectors pictures
techsupport,Logitech wired mouse ve had my logitech mouse for years and its always worked properly and the lights have worked also recently downloaded OpenRGB to see if could sync all the rgb lights on my computer not using the program anymore because it seems to have created more problems deleted all Open RGB folders and the other lights have returned to working as they did before Except for the mouse When unplug and plug it back in the lights will turn on momentarily and the have nothing dont have Logitech Hub installed Since bought the mouse years ago its been on random color breathing cycle ever since started using it Can anyone explain why it may have stopped
techsupport,Suddenly have gray through bunch of files on my PC and receive an error message when try to open them Out of nowhere gray has appeared through bunch of my pdf Word and Excel files and get an error message when try to open them check the file permissions for the document or drive make sure there is sufficient free memory and disk space open the file with the text recovery converter Please help
techsupport,Windows INACCESSIBLE_BOOT_DEVICE after moving SSD to new laptop Hello So originally had desktop computer but it died then got laptop and moved the SSD from the desktop computer to the laptop and now it bluescreens after seconds in the boot screen got the Windows installer to read my SSD using the Intel Rapid Storage Technology driver The problem is that don want to copy everything from one drive to the other reinstall Windows and install every program Is there any way to get the Windows Boot Manager to read my SSD in some way have the driver Is there any way for me to copy it on the Windows Boot Manager partition and get it working that way
techsupport,Weird TPM issue have enabled ftpm in the bios and am running Windows However one day when turned my PC on it said that have installed new CPU Which did not then it warned me it will have to do something to the TPM to boot Now TPM is enabled in bios but fails to start In windows device manager it says protocol error was detected between the driver and the device With the error code the device cannot start Here are my PC specs to help CPU Ryzen core RAM Corsair vengeance LPX gb DDR4 GPU Aorus RTX Elite gb Motherboard Gigabyte B550 Vison Any help will be nice thanks
techsupport,Is there safe way to open email attachments often get Random emails sometimes to include attachments If don know the source ignore the email and move on However recently missed some bills because company was working with changed ownership didn recognize the new company name so ignored the email So is there way can open PDFs and such and not worry about viruses
techsupport,Getting USB device not recognized error over and over for wireless mouse even though its working fine Hi all getting an error that have gotten many times on my laptop that says USB device not recognized Sometimes this error will pop up every couple of seconds for about five minutes in total before stopping The only USB device use is my wireless mouse and even when the error is actively popping up the mouse works fine Anyone know what might be causing this know how to prevent this
techsupport,Internet speed dropping issue Hello ve been having internet issues for while now My internet speed will drop down to only mbps download for seemingly little reason Upon restart it seems to fix the issue until it runs into this issue again This was happening with my previous Wi Fi chip which did replace the antennas on to see if it fixed it Did not so got new wifi chip which gets even better speeds but it didn solve the issue do sometimes get an error if troubleshoot but whether or not its automatically fixable is If this sounds like specific computer issue please let me know what you think could be causing it Any info that might be helpful Windows custom build few years old AMD Ryzen Six Core Processor GHz use wifi not ethernet Internet speed dropping disconnecting tend to be specific to my computer Do not have the troubleshooting error on hand It will mention how there is networking issue but at the moment can remember what exactly would be the thing blocking connection Restart would fix it but the troubleshooter would not mention it as solution Sorry it this isn enough info please ask any extra questions you have Generally am just asking for few options of what could be causing it Software updates hardware general direction think would be helpful
techsupport,Helpppp literally JUST built new PC like now haven touched it at all want it to be optimised for gaming performance but also don want to overclock anything don want ANY fps problems since my friends suffer from this What should do and start with Specs ti ryzen gb ram samsung evo pro tb tb hdd
techsupport,Laptop shuts off when closing moving the screen Laptop shuts off when closing moving the screen Laptop shuts off when closing moving the screen Laptop shuts off when closing moving the screen Laptop shuts off when closing moving the screen
techsupport,Is this link safe to download need to check if is safe tinytask download link it still works to so yes does it work when virus checked it it says this
techsupport,Do need to check if the CMOS battery is compatible with my motherboard before buying it My PC says Cmos battery failure while startup every time so figured out need to replace the CMOS battery but Im not sure if need specific one or anyone will do
techsupport,Windows seems to have restarted itself and lost unsaved work researcher and last night before bed had flood of ideas typed them into word document that had open before forgot them Stupidly then went to bed and didn save wake up this morning and they re gone the word document is as it was before typed them see that windows has an uptime of hours so it must have restarted around AM ve checked appdata gt Microsoft gt Word and the directory is empty Word isn prompting my to select unsaved files although PowerPoint is Any way to recover what had so mad right now not just at myself but Win10
techsupport,Redmi refuses to turn on So ve been having this constant issue with my Redmi9T where every time power it off Rebooting Shutting down Losing battery charge it refuses to turn on for no reason and doesn respond to charging Every time this happens just fiddle with leaving it on charge leaving it not on charge trying different chargers trying different sockets and genuinely don know what causes it to finally turn on or indicate it is being charged again ve had phones that received harsher treatment since used to not be stuck in my home all day and don know why this phone has an issue with turning off and on Please help
techsupport,commander pro fans Hi have commander pro and it was just fine till this day cause im upgrading my pc will now have LL120 fans thing is can only use fans on commander pro any way can connect fans was looking for fan splitters but could only find pins splitter with pins on them wanna be able to control my other fans and their rgb without any problem Thank you
techsupport,Windows File Permissions So from previous posts have been trying to access files from an old laptop drive externally and accidentally canceled during permission change process Now when the drive is back in many apps appear blacked out Edge seems broken as it shows permissions error and assume many other files are broken Is there way to reset permission to default for all files on user profile TL DR Broken file permissions Reset to default
techsupport,Tablet always used plugged in Is it okay for the battery Hi So have pretty crappy tablet which basically use as pomodoro device when studying or just to display an image when draw The screen timeout is set to Never so keep it plugged in Does this degrade the battery lot usullay turn it off when it not in use know that the best would be to keep it between and all the time but the battery is rather small and it takes about hours to get from to So will this usage degrade the battery can imaging that would like to use it for studying unplugged later Thanks in advance for your advices
techsupport,has the appearance and function google search and maps changed for anyone else this week windows waterfox search no long gives page numbers at the bottom of the page and it now auto fills images is totally different and harder to navigate it almost seems as if it trying to do mobile version on pc windows wanted to see if it more of an issue with my browser being hijacked changed without my knowledge or direction or if google just changed things so that older browsers don work no changes were made to the OS no apps added or uninstalled very weird using google with and older version of firefox and it seems to work ok
techsupport,Display mirroring to TV not sure if this belongs here but work in finance and often find use for whiteboard to explain things to clients However like to have this whiteboard be digital on large tv in the conference room was originally thinking drawing pad makes sense but my understanding is that would require drivers on my work computer which is non starter with my firm Additionally don have Wi Fi and connecting to the company network Is not an option Any suggestions of solutions or other subs to post on are welcome Thanks
techsupport,Can move rename delete an image of green spongebob hairy ass Please help was cleaning out my downloads folder and there is this stupid fucking image have of spongebob ass after he drank kelp juice that can be moved at all renamed or deleted know it may seem like joke so uploaded quick video to show serious help get this image off my computer please yc
techsupport,Larger ping spikes on new Legion Laptop Hey everyone recently purchased Legion laptop with Realtek RTL88852AE Wifi ax adapter and am experiencing very large ping spikes in games Usually get around ping but every seconds or so it jumps up to high numbers close to the range pinged Google com in cmd and get an average of ms or so get this it seems no matter what network am connected to tested my and bands and tested connecting to my phones hotspot and still get the same results My work laptop and an older laptop get very standard network performance with no large ping spikes Pinging Google com on these devices get around ms Anyone have any ideas what might be going on Any troubleshooting methods can try
techsupport,Outlook issue Immersive Reader type font in email but there no Immersive Reader button to turn it off an IT Admin and can seem to resolve an issue one of my users is having She using Office Outlook on Windows computer When she views an email it appears as though Immersive Reader is on The letters are spaced out words are further apart than usual and its different font than normal ve uninstalled the program reinstalled it scoured the internet and options menus to try to find solution but stuck There is no Immersive Reader button under the View tab even tried editing the toolbar but there no option for Immersive Reader Any suggestions or help Should just open ticket with Microsoft Thanks
techsupport,Should move my files to from drive to drive When google it is always showing which files to move and not the advantages or disadvantages of moving the files from to drvie or should even do it
