subreddit,text_tokens
techsupport,Is it possible for me to play flash games on an older version of PBS kids was curious about the PBS kids website used to play flash games on when was younger went on the wayback machine to have look at it and wondering Is it possible to play the flash games on the older version of the website Even if could run flash is it possible to access the games that aren available on the current website Don know if there any more helpful information can provide because have absolutely no clue what am doing but if you have any knowledge it would be appreciated
techsupport,WHEA Uncorrectable Error Hi all So after bit of digging it looks like this is might be computer hardware issue My question is which part typically causes errors like these My tower got jostled bit when was moving Should reseat everything Is it an OC issue Thanks
techsupport,Clicked on link and immediately got phone calls Advice was scrolling through reddit thread on my phone and unfortunately clicked on link left by what seems to be bot immediately closed the tab that was opened but about minute after received multiple calls to my phone number via skype The calls were not made to my skype account but to my phone Any suggestions on next steps
techsupport,Sony WF XB700 Bought new pair of Sony wireless earphones and the left earbud is flashing red in the charging case Ive pulled it apart incase it was the power cable pins but still flashing red in case and no power at all when out Please help
techsupport,My headphones keep breaking Every pair of headphones own without fail eventually looses sound on one side ve been painstakingly gentle with them ve used cheap headphones high end headphones earbuds they always break This has been going on for years please help
techsupport,Xbox One and Series Help Purchased Games DLC Updates will not download on home network but will using phone hotspot Hello all about to tear my hair out over this one After two months on waiting list finally got Series at the start of the week Set it up transferred some games downloaded some games cleared up some space on my Xbox One Great ll download some games couldn fit on the Xbox One before Now suddenly nothing will download from the store Games will not download updates for games installed from disc will not download and DLC will not download It constantly says installation stopped and error code x87e0005 And to top it off the same games updates DLC will not download on the Series either and give the same error ve tried every fix and troubleshooting solution can find online for this error and nothing has helped thought maybe it could be my router so connected the Xbox One to my phone wifi and suddenly IT WORKED But this isn fix and need the downloads to work on my home network ve tried the downloads over wifi and ethernet with no change assuming need to change some kind of setting with my router but have no idea what and can find anything via google Does anyone know how to fix this please
techsupport,An easier way to download large chrome files The file is gb It says hours though fails due to network error after hours Is there any way can download the file faster and without error Perhaps software that can can paste the download link into that will download it for me
techsupport,GPU fan loud when computer is idle Out of nowhere my GPU AMD Radeon HD started running at full blast and staying that way when windows would load updated the drivers and that didn help downloaded MSI afterburner and with that can control the fan speed so it isn loud at least However what if my gpu temp goes up and the fans need to spin more to cool it down will fan speed go up to compensate would like to know the best settings for MSI afterburner when set it to automatic or default the fan goes full blast again just worried that the current setting could overheat my gpu if the fan speed won increase if it has to
techsupport,Spilled water on keyboard and now pc won start Title pretty much sums it up spilled water on my keyboard and minutes later the pc shuts down and turns on for second then turns off and repeats If anyone knows what wrong or what to do greatly appreciate it
techsupport,can login to tumblr ok so recently bought new laptop macbook air not sure the model bought it from friend running OS El Capitan think its fully up to date for this model my safari is running and is also up to date tried to log into tumblr made the account on my phone web browser duck duck go don have the app for various reasons have iPhone SE2 yeah ik an apple brat lol tried to log in with my account information and it keeps giving me an all white screen that says cannot POST login know it logs me in because ve gotten an email that says ve been logged in on new device yada yada ve been trying to log in for almost week now started on the th currently writing this on jan th with no other results my preferred browser is duck duck go but have tried to use different browsers yahoo safari google chrome etc with no success tips new to reddit so if can find way to attach picture of the white screen of death will thanks
techsupport,Windows SE GPU What to get was looking for Windows GPU and found ATI X800XT AGP MB Higher end card but for but found Sapphire ATI Radeon SE for What card should buy
techsupport,fixing happened during startup my pc was working normally just yesterday but when booted it up while ago it started doing this fixing thing it only took about minutes then booted normally im wondering if should get it checked by professional or if it all good that the first time encountered that process so im not sure what should do thanks
techsupport,bottleneck on bottleneck pissed build PC and now it just bottleneck ve change hhd and SSD upgraded my build now have i7 with rtx super gbs ram and my cpu is always at around and GPU at like and getting fps on fornite on low setting tried different res nothing change my GPU update are up to date thanks you
techsupport,Loud pop then computer wont turn on was going to turn on my pc but heard loud pop and it doesnt seem to recive any power
techsupport,Transfer data especially contact info from LG phone to iphone confused Hi trying to transfer data from my LG phone to an iphone and confused There are so many apps and so many methods just want to do this in way that efficient and safe and secure so if possible not use an app or over the Internet starting with transferring contacts As someone had suggested went to manage contacts on my LG phone then was given options for import back up copy merge and chose back up then chose SIM card will use the same card in the iphone then okay then put checkmark on top to select all the contacts it was showing and finally clicked back up but then window popped up saying contacts will duplicate and some info may not back up Back up anyways confused Does this mean the info was already on the SIM card or is this just general warning never backed up my contacts as far as can recall Thanks for your help
techsupport,Computer says no internet and shows no options for me to connect to network just started having this issue today Earlier it said had no internet but could still use Google but couldn play some online games Then when went to troubleshoot it through windows it restarted my pc and now don see any options for networks looked up guide on YouTube and that still didn work tried troubleshooting again and it said that my adapter wasn working when it has been working perfectly fine for the past few days
techsupport,Accidentally clicked on suspicious ad was on spanishdict and clicked on an add that took me to gamebass com site with free games Never heard of this site before and google doesn have much info either deleted my history cookies and cache along with look at my downloads What are the chances that my computer is infected on in macbook pro m1 pro btw Any info is greatly appreciated
techsupport,HP system fan error Hi all just encountered error the cooling fan of my laptop seems not to be working properly What should do about this If there are any at home solutions would like to attempt that first am in foreign country where dont know the language well so going to professional repair shop may be challenge but am willing to do it if the issue seems serious Please let me know and advice and experiences thank you
techsupport,Odd issue with coil whine recently acquired gtx ti gb from evga as part of budget pc build for someone who main purpose is playing Minecraft and watching YouTube Out of the of them have coil one but can figure out what causing it Grounding the pc makes the coil whine worse on one of them and doing anything that uses the nvenc encoder makes the other produce scream from the pits of hell Do you think these are defective units or is this normal
techsupport,Ever since upgrading to ti from an RX5600 XT getting massive FPS drops Hey all Kind of at my wits end with this one Here are the specs x200B Asus B550 ac Ryzen gb Corsair RGB Pro x16 EVGA PLus Bronze Asus Rog Strix ti OC LHR CoolerMaster ML360R AIO Win was running win pro but changing to Win seemed to help with Black Ops Cold war issues Lian Li Dynamic with side rear exhaust bottom intake noctua running intake on AIO Asus hz monitor CPU and RAM are OC currently Issue happens without or without OC GPU is stock atm Issue is that when playing only certain games the frames will drop to or below usually This is the GPU dropping to or lower usage This happens on Guardians of the Galaxy no matter the settings every minute or so This happens on Shadow of the tomb raider unless its on settings lower than my old xt could handle Other games as well Warzone and Cold war run great Hitting Windows key or alt tab brings frames back instantly and they return to crap as soon as the game is in the foreground and the main on screen program No rhyme or reason to when it returns to normal It chooses when Longest was about minutes Fastest was about seconds ve done massive troubleshooting but cant really find any issues No bottlenecks was thinking its either the card or the mobo Mobo is known to run very hot not sure if issue and card was bought brand new from NewEgg shuffle winner Temps never get above for CPU GPU never gets above think it was even low in the stress tests Stress tests are very good cant figure it out Any advice
techsupport,Lenovo windows laptop glitching screen sorry if this isn the correct place to inquire on this have lenovo thinkpad xi yoga gen it in1 but never really use tablet mode ve had for years now with no problems it done everything need it to do and more several months ago the screen began to glitch took it to computer repair shop and he was unable to pinpoint the issue but thinks he ruled out it being due to hardware more specifically my concern says he ruled out it being the GPU the screen glitch is hard to describe and he wasn able to recreate it because it doesn happen consistently notice it most when my laptop has been on for over hours regardless of what is running it mostly purple glitches and tints over the screen sometimes minor sometimes to the point have hard time seeing what doing during this time anything have running will appear semi transparent where can see glimpses if things had open earlier in the session there is also consistent clear meaning normal in this case block near the top of the screen where the glitch will start the block is normal then the glitch resumes run mostly google chrome adobe creative cloud software for work and school and games like FFXIV on the lowest settings ve done my own research and have yet to find solution and the last time took my laptop to him he had it for about week something am unable to do again for work and school so figured try out my luck here
techsupport,tablet will turn on but screen remains black the screen of my samsung tablet had started glitching out recently flickering black blocks of colour appearing and disappearing image distorting etc while was using it kept using it for while to see if it would go away but when it didn googled how to fix it found website that suggested restart my tablet but once after trying can not get the screen to turn back on the tablet itself in on know this because heard the boot up chime and the menu back buttons below the screen light up when the power or home button is pressed is there way to fix this what could have caused it
techsupport,Computer completely refusing to turn on Hey all so about months ago built computer with my uncle and it worked out fine almost no issues besides me forgetting to install drivers lol specs were as follows Ryzen MSI Tomahawk b450 MAX II Crucial Ballistix gb mhz WD Sn550 tb nvme drive XFX Rx gb Evga Watt bq Hyper evo Corsair It worked fine for the first few months up until Christmas Eve where out of nowhere the pc shut off with bsod Too fast to see the error so don know what it was and then refused to turn on completely At first thought it was the psu so replaced it with Corsair watt gold unit but after got home from Best Buy it was still refusing to turn on Fast forward few days ago ordered new mobo and cooler because didn wanna deal with the evo again So my current specs are R5 Aorus b450m Noctua NHU12s Redux Rx gb WD sn550 tb Corsair gold unit Crucial Ballistix gb mhz And it continuing to have the same issue when tried hooking up the old psu the fan spins for short second and then shuts off and there no fan spin at all for the newer one Some important things to note have gone through many many checklists and none of them worked have completely rebuilt the system multiple times have tried with one stick of ram no luck have tried with different cooler no luck The debug lights on my old mobo would flash for split second to show debug lights and the lights that would turn on were vga dram and boot have tried almost everything If anyone at all can figure out what wrong with my pc that would be great Thanks
techsupport,Rural Area Going to Remote Work Need Faster Internet start new remote job next week It requires me to use my computer to make calls to clients live in very remote area with weak access to the internet reasonably savvy with computer software but ve had terrible pack of success figuring out how to get the fastest speeds in my area tried Verizon and Mobile hotspots They work terribly where live Then got Nomad internet It works alright most of the time for streaming Netflix But my Zoom calls cut in and out and what have currently just won cut it for the demands of my new job would love some specific advice on ideas to try Thank you for your help
techsupport,could you replace CPU Fan with Noctua NF P12 intel stock cpu fan is loud and substandard could replace it with spare fan have the spare ref ppx yo2 dt product details ref ppx_yo2_dt_b_product_details dont have the link for my cpu fan
techsupport,this device might have trouble displaying your content because its hardware wasn specifically designed for wireless projection can someone help me with this device might have trouble displaying your content because its hardware wasn specifically designed for wireless projection in Projecting to this pc section in settings
techsupport,Realtek HD audio manager not downloding Error Too much download times You can only download this file for times in day Can someone help me So was trying to download the Realtek Hd audio manager and because it had low download speeds shut my computer not fully and waited for it to download it said download failed and when clicked retry it just opened something that wasnt the Realtek audio mangaer The reason need Realtek Audio manager is cuz it isnt on my pc and Im having problems with my headphones So fast forward to when messed around with it downloaded it like times until got download manager and then when went to download again so could download through the manager it said Error Too much download times You can only download this file for times in day waited day and it said the same thing tried changing the date on my PC and then it said THE ABSOLUTE SAME THING PLease god help me need the audio manager and Realtek is screwing with me testing my patience
techsupport,Windows won detect Varmilo VA87M Keyboard Hi guys ve recently bought second hand Varmilo keyboard and it was working prior to me receiving it ve tried downloading the drivers from their website but which ever one tried was met with bridge device not found boot device not found message ve tried different cables connecting to several different computers holding the fn delete fn insert keys with no luck and can even get it to light up much less be detected by windows ve even tried taking it to computer repair shops to save myself the trouble but they both turned me away saying it usually never worthwhile to fix keyboard and just buy new one like generic ROG one he pointed to and not sure if that was because they aren super well versed in keyboards or not ve run out of options and recently emailed Varmilo support few days ago for any chance at figuring it out but would greatly appreciate any help in getting myself stepping in the right direction because it really is such nice keyboard
techsupport,Booting issues with Asus zenbook Model and make Asus Zenbook flip OS Windows Specs i5 GO ram and go SSD Issue computer doesn boot properly Temporary solution if plug the AC and unplug the internal battery and then after hit power plug back the internal battery and unplug the AC windows boots it won boot if AC is plugged it will shut down again it won even turn on of only battery is plugged reinstalled windows and updated all drivers didn change anything cleaned the inside with rubbing alcohol already and found no obvious signs of something that is broken physically Condition bought this computer used from someone who said that they spilled pop soda on it
techsupport,dns server error occurring on only one computer ve been having this problem since october everything else in my home connects flawlessly to wifi except my desktop computer have tried every single link from the first five pages of google flushed all my settings tried and failed to roll back drivers updated drivers everything used three ethernet cables and two separate wifi dongles the second one worked for few days but failed and hasn worked since this desktop was gift so not sure what inside the machine but it had wifi connection problems on and off ever since got it it used to be could reset the computer to fix it but now no matter what do it never connects it simply says DNS server is not responding no matter what disable and re enable update or roll back nothing fixes it it becoming extremely frustrating as basically can no longer use my only computer my question is what could be causing this not the best with computers so can think of single other solution
techsupport,Help Laptop Battery doesn last more than minutes after being fully charged have Dell XPS and it is few years old About year ago the battery seemed to stop holding charge and would immediately die after being unplugged for minutes regardless of what percentage it was charged to finally got around to getting new battery for it as thought this was obviously the issue as the laptop is about years old Well installed the new battery and to my surprise same issue The laptop is charging when it plugged in so that not the issue It shows when unplug it and then rapidly drops to in about minutes and will turn off and give the low power warning and won be able to use it unless plug it in What could be the problem Help
techsupport,Question about MSi Dragon Center installing Bios updates just fixed my nephews computer that had bad bios install He does have MSI gaming Motherboard The thing is he claims that right before he left for school and some other stuff MSI Dragon center started to install updates on its own and while he was gone it started some bios updates He came back home to system that would not boot come over and help him recover and update the bios To be honest not familiar with the Dragon center software and all its quirks just have hard time believing it would do bios update on its own without giving big warning and prompting for confirmation The only time saw bios update being crammed and forced was in corporate setting kinda have my doubts but dont have much experience with MSI to go on So is this thing that MSI does with dragon center
techsupport,Idk if my question is stupid but my wireless mouse isn working on my HP laptop Idk how it happen it suddenly just stopped working its on and it won move My headphones don work when plug them in either because there no sound coming from the computer so can you people pls help
techsupport,Bluetooth Will face any connection interruption between my bt4 mobile device and bt5 earbud
techsupport,PC HELP recently got new graphics card NVIDIA GeForce ve installed it and updated the drivers and it even shows up in settings but my pc keeps turning off when try booting up games can anybody help me
techsupport,Troubleshooter returns errors after trying to diagnose issues with my ethernet port connection An unexpected error has occurred The troubleshooting wizard can continue Error x80070483 OR Ethernet doesn have valid IP configuration So ve been experiencing the latter issue for while now and my ethernet port refuses to connect online dispite what ve tried ve restarted my modem Disabled fast startup ve done the ncpa cpl stuff ve tried insuring that getting an automatic IP address as well as tried to set static one ve tried the netch commands Cleared my network cache reinstalled my network drivers Now finding that my troubleshooter is returning the former error either randomly during the diagnosis process or when try to give feedback on it beginning to think my Windows install might just be corrupted and that ll need to reinstall it But want to exhaust every option before do that
techsupport,Laptop won connect to external monitor have Lenovo Thinkpad T470s recently bought an ASUS VG279 The asus monitor connects with my PlayStation and my other asus laptop but my Lenovo won recognize the monitor tried updating the drivers Used different HDMI cords and tried the USB to HDMI connection Is there something else missing here
techsupport,Computer randomally turning off and not turning on after few days Apologize for my bad grammar Typing this on phone So bought this cyberpower computer around november and since then ive been getting nothing but one problem with it The first time problem happen was the power supply being faulty after like months from buying it Wasnt too bad so easily replaced the old power supply which was Apevia The current one thats in my computer is evga power supply The computer was working just fine till like month ago there was power outage and this has caused the same problem with my computer ever since It would refuse to turn on just like my old power supply would and ive tried everything to get the computer to work Ive tried replacing the cord Didnt work Ive tried holding down the power button Didnt work Ive even changed the outlet in different places in the house live in condo complex and it STILL didnt work So about week after the power outage brought it in for repairs and NOW decideds to turn on said ck it and let them run full diagnosis on the computer Stress testing everything to find the problem and they found nothing So after got the computer back its would run for about days before doing the same crap of not turning on Ive tried the same methods ive done before and it still doesnt want to turn on but after day of not touching the computer push the power button and decides to turn on again For the pass few weeks now its been repeating over and over and am getting annoyed need some help is it the power supply again Is my computer not getting power need some help Any help
techsupport,Bluetooth thinks my phone is playing audio and stops playing the radio why Just recently my Ford Fusion Sync radio has started doing this thing where when have my phone plugged in it randomly stops playing the radio and says Bluetooth audio stream detected but won be playing anything on my phone ve restarted the radio ve unplugged my phone completely ve restarted my phone ve uninstalled and reinstalled android auto app ve tried using different cable and nothing works but figuring it has to be problem with my phone because my girlfriends same exact phone has no problem with the radio We both have s10 and we don have this problem when we connect her phone Any guess on what the problem could be
techsupport,My computer doesn want to display boot up to atleast bios after cleaning up the wires and replacing the CPU fan Might have done something wrong or there something don know but ve got older but not ancient pc from An ECS G41 think first version with version BIOS idk with Intel LGA775 mobo In bios it seemed like the CD drive was little importan something like IDE master but for now only need to buy blank disk for an install and it worked fine disconnected for the last month don know if the wires from the PSU are supposed to be plugged in an specific way and the power isn flowing right or what The fan if pretty much the same just with bigger heatsink Nothing ve tried worked but ve been little lazy so haven tried everything So far ve Removed one and both RAM sticks Removed the CMOS battery to reset BIOS and slightly tried fiddling with the wires just tied it fine Still like little zip ties left almost so small that they re not worth the fiddling but chose them It did boot up once after removing RAM stick and shut down not long after Thr GPU was unusually hot this time though that hasn happened again though Had the manual downloaded but haven fully read it yet Only checked specifics Didn know about this subreddit till now and would rather try this for change Please bless me this one with the knowledge to defeat technical issues
